{"type":"config","name":"Optimizing multi-task RNN test accuracy on 93 Yang19 tasks","metricName":"mean_acc","metricUnit":"","bestDirection":"higher"}
{"run":1,"commit":"84443e4","metric":0.733004,"metrics":{"go_acc":0.761628,"dm_acc":0.67902,"dlydm_acc":0.892532,"match_acc":0.538709,"tasks_above_50":75,"tasks_above_80":54},"status":"keep","description":"Baseline: mean_acc=0.733 with HIDDEN=256, LR=1e-3, EPOCHS=30, BATCH=64","timestamp":1774129045862,"segment":0,"confidence":null,"asi":{"hypothesis":"baseline run","weakest_family":"match_acc=0.54","strongest_family":"dlydm_acc=0.89"}}
{"run":2,"commit":"c13bb1f","metric":0.754059,"metrics":{"train_acc":0.856549,"go_acc":0.776032,"dm_acc":0.68531,"dlydm_acc":0.912949,"match_acc":0.57644,"tasks_above_50":75,"tasks_above_80":59},"status":"keep","description":"Add train_acc monitoring + data caching. Train acc=0.857 — model is underfitting, not overfitting.","timestamp":1774129323375,"segment":0,"confidence":null,"asi":{"hypothesis":"add diagnostics and caching","key_finding":"train_acc=0.857 — model underfits, need more capacity/epochs","next_action":"increase hidden size and epochs to push train acc toward 100%"}}
{"run":3,"commit":"c13bb1f","metric":0.79699,"metrics":{"train_acc":0.989735,"go_acc":0.83926,"dm_acc":0.749184,"dlydm_acc":0.946331,"match_acc":0.597921,"tasks_above_50":75,"tasks_above_80":60},"status":"keep","description":"HIDDEN=512, EPOCHS=60: train_acc=0.99, test_acc=0.797. Underfitting solved, now generalization gap.","timestamp":1774129551596,"segment":0,"confidence":3.038993113274749,"asi":{"hypothesis":"more capacity+epochs to fix underfitting","key_finding":"train_acc=0.99 achieved, test=0.797. Generalization gap ~0.19. Match still weakest at 0.60","next_action":"add dropout/weight decay for regularization, or try LR schedule"}}
{"run":4,"commit":"5c7cd60","metric":0.869758,"metrics":{"train_acc":0.925655,"go_acc":0.851182,"dm_acc":0.743194,"dlydm_acc":0.92761,"match_acc":0.895122,"tasks_above_50":88,"tasks_above_80":67},"status":"keep","description":"Dropout=0.3 + weight_decay=1e-4: test_acc=0.870, match_acc 0.60→0.90. Massive regularization win.","timestamp":1774129764339,"segment":0,"confidence":4.274497546338264,"asi":{"hypothesis":"dropout 0.3 + weight decay to close generalization gap","key_finding":"test jumped 0.797→0.870. Match family massive improvement 0.60→0.90. DM still weakest at 0.74","next_action":"try more epochs, LR schedule, or 2-layer GRU"}}
{"run":5,"commit":"922257f","metric":0.906325,"metrics":{"train_acc":0.982397,"go_acc":0.870861,"dm_acc":0.757113,"dlydm_acc":0.951211,"match_acc":0.97894,"tasks_above_50":90,"tasks_above_80":74},"status":"keep","description":"EPOCHS=100 + cosine LR: test_acc=0.906, match=0.98. DM still weakest at 0.76. 320s runtime.","timestamp":1774130112362,"segment":0,"confidence":2.7087331603788343,"asi":{"hypothesis":"more epochs + cosine LR schedule","key_finding":"test=0.906. DM family is bottleneck at 0.76. Runtime 320s approaching limit.","next_action":"focus on DM tasks, try bigger batch or 2-layer GRU, watch runtime"}}
{"run":6,"commit":"922257f","metric":0.814996,"metrics":{"train_acc":0.982607,"go_acc":0.779369,"dm_acc":0.696804,"dlydm_acc":0.949802,"match_acc":0.755987,"tasks_above_50":83,"tasks_above_80":64},"status":"discard","description":"2-layer GRU: test=0.815, worse than 1-layer (0.906). Also slower (437s).","timestamp":1774130571004,"segment":0,"confidence":2.996067381740552,"asi":{"hypothesis":"2-layer GRU for more capacity","rollback_reason":"worse test acc 0.815 vs 0.906, 2x slower","next_action_hint":"try bigger batch size or higher LR with 1-layer, or data augmentation"}}
{"run":7,"commit":"922257f","metric":0.902076,"metrics":{"train_acc":0.992793,"go_acc":0.938991,"dm_acc":0.733031,"dlydm_acc":0.940299,"match_acc":0.923034,"tasks_above_50":93,"tasks_above_80":69},"status":"discard","description":"Dropout=0.5, batch=128: test=0.902 slightly worse than 0.906. Go improved but DM dropped.","timestamp":1774130766977,"segment":0,"confidence":2.8442653888442164,"asi":{"hypothesis":"higher dropout 0.5 + batch 128","rollback_reason":"mean_acc 0.902 < 0.906, DM got worse","next_action_hint":"try dropout 0.4, or AdamW with higher weight decay, or LR=3e-3"}}
{"run":8,"commit":"f8e5e3c","metric":0.945448,"metrics":{"train_acc":0.998636,"go_acc":0.988745,"dm_acc":0.783817,"dlydm_acc":0.960174,"match_acc":0.984762,"tasks_above_50":93,"tasks_above_80":83},"status":"keep","description":"LR=3e-3: test_acc=0.945! All families strong. DM=0.78 still weakest. 93/93 above 50%, 83 above 80%.","timestamp":1774131097333,"segment":0,"confidence":3.4362984949088946,"asi":{"hypothesis":"higher LR=3e-3 with cosine schedule","key_finding":"test=0.945. Go=0.99, match=0.98, dlydm=0.96, DM=0.78 still bottleneck. train=0.999","next_action":"focus on DM family, try even higher LR or longer training"}}
{"run":9,"commit":"a7ce6ff","metric":0.947945,"metrics":{"train_acc":0.997987,"go_acc":0.995288,"dm_acc":0.784697,"dlydm_acc":0.962487,"match_acc":0.984454,"tasks_above_50":93,"tasks_above_80":83},"status":"keep","description":"LR=5e-3, EPOCHS=150: test=0.948, marginal gain. DM=0.785 barely moved. 472s runtime.","timestamp":1774131592892,"segment":0,"confidence":2.9537846306068585,"asi":{"hypothesis":"LR=5e-3, 150 epochs","key_finding":"0.948 marginal over 0.945. DM stuck at 0.78. Runtime 472s too long","next_action":"need architectural change for DM, or task-specific loss weighting"}}
{"run":10,"commit":"a7ce6ff","metric":0.924747,"metrics":{"train_acc":0.994598,"go_acc":0.966321,"dm_acc":0.798283,"dlydm_acc":0.957386,"match_acc":0.921416,"tasks_above_50":93,"tasks_above_80":79},"status":"discard","description":"Task-weighted loss (3x DM): DM 0.78→0.80 but overall 0.948→0.925. Hurts other families.","timestamp":1774131985751,"segment":0,"confidence":3.5364061895869545,"asi":{"hypothesis":"3x loss weight on DM tasks","rollback_reason":"overall acc dropped 0.948→0.925, DM gain not enough to compensate","next_action_hint":"try LSTM instead of GRU, or input noise augmentation, or larger hidden with more dropout"}}
{"run":11,"commit":"cfb97af","metric":0.957187,"metrics":{"train_acc":0.992564,"go_acc":0.997679,"dm_acc":0.805225,"dlydm_acc":0.971565,"match_acc":0.993698,"tasks_above_50":93,"tasks_above_80":85},"status":"keep","description":"Input noise augmentation (σ=0.1): test=0.957, DM=0.805. 85/93 above 80%. Runtime 471s.","timestamp":1774132489208,"segment":0,"confidence":4.887462120386313,"asi":{"hypothesis":"Gaussian input noise σ=0.1 as data augmentation","key_finding":"test=0.957, DM improved to 0.805. All families above 0.80 now.","next_action":"reduce epochs back to 100 for faster iteration, try LSTM or label smoothing"}}
{"run":12,"commit":"cfb97af","metric":0.793927,"metrics":{"train_acc":0.858434,"go_acc":0.78248,"dm_acc":0.774925,"dlydm_acc":0.963413,"match_acc":0.605391,"tasks_above_50":75,"tasks_above_80":62},"status":"discard","description":"LSTM instead of GRU: test=0.794, much worse. LSTM underfits at 100 epochs.","timestamp":1774132838142,"segment":0,"confidence":3.3724661336301898,"asi":{"hypothesis":"LSTM instead of GRU","rollback_reason":"LSTM converges much slower, train_acc only 0.86 at 100 epochs","next_action_hint":"stick with GRU, try label smoothing or larger hidden size"}}
{"run":13,"commit":"cfb97af","metric":0.91181,"metrics":{"train_acc":0.972555,"go_acc":0.950064,"dm_acc":0.821431,"dlydm_acc":0.974464,"match_acc":0.851724,"tasks_above_50":89,"tasks_above_80":76},"status":"discard","description":"Label smoothing=0.1 + 100 epochs: test=0.912. Worse than best (0.957) due to fewer epochs.","timestamp":1774133194064,"segment":0,"confidence":4.887462120386313,"asi":{"hypothesis":"label smoothing 0.1","rollback_reason":"0.912 < 0.957 best, reducing epochs to 100 hurt more than label smoothing helped","key_insight":"DM=0.82 actually good with label smoothing, try combining with 150 epochs","next_action_hint":"try label smoothing WITH 150 epochs, or try hidden=1024 with more dropout"}}
